{
  "schema": "civilizational_delta_audit_v1",
  "created_at": "1970-01-01T00:00:00Z",
  "caution": "Bounded advisory only; use watch/docket follow-up and avoid closure or authority claims.",
  "decision": "warn",
  "findings": [
    {
      "id": "delta:map",
      "severity": "warn",
      "type": "docket-review",
      "advisory": "docket",
      "message": "Missing or invalid delta inputs; fail-closed docket review required (civilizational_delta_map.json).",
      "data": {
        "missing": "civilizational_delta_map.json"
      }
    }
  ]
}
